web-scraper-order,web-scraper-start-url,disinfo-case-link,disinfo-case-link-href,title,date,keywords
1653633207-657,https://euvsdisinfo.eu/disinformation-cases/?text=&date=&disinfo_countries%5B0%5D=77547&per_page=100&offset=400,Ukraine is controlled by State Department with the help of the CIA and Polish special services,https://euvsdisinfo.eu/report/ukraine-is-controlled-by-state-department-with-the-help-of-the-cia-and-polish-special-services,Disinfo: Ukraine is controlled by State Department with the help of the CIA and Polish special services,DATE OF PUBLICATION: 14/09/2021,"Keywords: Volodymyr Zelensky, Puppets, Secret services, CIA"
1653633221-662,https://euvsdisinfo.eu/disinformation-cases/?text=&date=&disinfo_countries%5B0%5D=77547&per_page=100&offset=400,The Belarusian history is limited to the history of the Russian world and the USSR,https://euvsdisinfo.eu/report/the-belarusian-history-is-limited-to-the-history-of-the-russian-world-and-the-ussr,Disinfo: The Belarusian history is limited to the history of the Russian world and the USSR,DATE OF PUBLICATION: 16/09/2021,"Keywords: Russian world, Historical revisionism, Imperialism/colonialism, Russian expansionism, USSR"
1653633331-700,https://euvsdisinfo.eu/disinformation-cases/?text=&date=&disinfo_countries%5B0%5D=77547&per_page=100&offset=400,The Germans recognised that Ukraine is a failed state,https://euvsdisinfo.eu/report/the-germans-recognised-that-ukraine-is-a-failed-state,Disinfo: The Germans recognised that Ukraine is a failed state,DATE OF PUBLICATION: 04/10/2021,"Keywords: Ukrainian statehood, Trolls"
1653633227-664,https://euvsdisinfo.eu/disinformation-cases/?text=&date=&disinfo_countries%5B0%5D=77547&per_page=100&offset=400,"Before WWII, Poland unleashed a real genocide in Western Ukraine and Belarus",https://euvsdisinfo.eu/report/before-wwii-poland-unleashed-a-real-genocide-in-western-ukraine-and-belarus,"Disinfo: Before WWII, Poland unleashed a real genocide in Western Ukraine and Belarus",DATE OF PUBLICATION: 17/09/2021,"Keywords: Genocide, WWII, Historical revisionism, WWI, Occupation"
1653633363-711,https://euvsdisinfo.eu/disinformation-cases/?text=&date=&disinfo_countries%5B0%5D=77547&per_page=100&offset=400,Current Ukrainian regime came to power after the foreign-led “Orange Revolution” in 2013,https://euvsdisinfo.eu/report/current-ukrainian-regime-came-to-power-after-the-foreign-led-orange-revolution-in-2013,Disinfo: Current Ukrainian regime came to power after the foreign-led “Orange Revolution” in 2013,DATE OF PUBLICATION: 11/10/2021,"Keywords: Euromaidan, Donbas, Civil war, Colour revolutions, War crimes"
1653633160-641,https://euvsdisinfo.eu/disinformation-cases/?text=&date=&disinfo_countries%5B0%5D=77547&per_page=100&offset=400,CNN revealed CIA-led operation against Belarus using Wagner members,https://euvsdisinfo.eu/report/cnn-revealed-cia-led-operation-against-belarus-using-wagner-members,Disinfo: CNN revealed CIA-led operation against Belarus using Wagner members,DATE OF PUBLICATION: 08/09/2021,"Keywords: CIA, Intelligence services, SBU, FSB, Foreign mercenaries, Ukraine"
1653633440-738,https://euvsdisinfo.eu/disinformation-cases/?text=&date=&disinfo_countries%5B0%5D=77547&per_page=100&offset=400,"Poland, Lithuania and Ukraine attempted to stage a coup in Belarus",https://euvsdisinfo.eu/report/poland-lithuania-and-ukraine-attempted-to-stage-a-coup-in-belarus,"Disinfo: Poland, Lithuania and Ukraine attempted to stage a coup in Belarus",DATE OF PUBLICATION: 25/10/2021,"Keywords: Coup, Protest, Imperialism/colonialism"
1653633907-811,https://euvsdisinfo.eu/disinformation-cases/?text=&date=&disinfo_countries%5B0%5D=77547&per_page=100&offset=500,The Crimean Platform was a failure,https://euvsdisinfo.eu/report/the-crimean-platform-was-a-failure,Disinfo: The Crimean Platform was a failure,DATE OF PUBLICATION: 26/08/2021,"Keywords: Crimea, Occupation, Ukrainian statehood, Ukraine, Abandoned Ukraine"
1653633788-769,https://euvsdisinfo.eu/disinformation-cases/?text=&date=&disinfo_countries%5B0%5D=77547&per_page=100&offset=500,The US should leave Ukraine as it did with Afghanistan,https://euvsdisinfo.eu/report/the-us-should-leave-ukraine-as-it-did-with-afghanistan,Disinfo: The US should leave Ukraine as it did with Afghanistan,DATE OF PUBLICATION: 17/08/2021,"Keywords: Puppets, Occupation"
1653633813-778,https://euvsdisinfo.eu/disinformation-cases/?text=&date=&disinfo_countries%5B0%5D=77547&per_page=100&offset=500,Kyiv heightens tension in Donbas,https://euvsdisinfo.eu/report/kyiv-heightens-tension-in-donbas,Disinfo: Kyiv heightens tension in Donbas,DATE OF PUBLICATION: 19/08/2021,"Keywords: Donbas, War in Ukraine, Minsk agreements, Crimea"
1653633783-767,https://euvsdisinfo.eu/disinformation-cases/?text=&date=&disinfo_countries%5B0%5D=77547&per_page=100&offset=500,"The West has turned Ukraine into a puppet, Belarus may follow the same fate",https://euvsdisinfo.eu/report/the-west-has-turned-ukraine-into-a-puppet-belarus-may-follow-the-same-fate,"Disinfo: The West has turned Ukraine into a puppet, Belarus may follow the same fate",DATE OF PUBLICATION: 17/08/2021,"Keywords: Volodymyr Zelensky, Puppets, Sovereignty"
1653633847-790,https://euvsdisinfo.eu/disinformation-cases/?text=&date=&disinfo_countries%5B0%5D=77547&per_page=100&offset=500,Involvement of external forces in Ukrainian domestic politics made civil war inevitable,https://euvsdisinfo.eu/report/involvement-of-external-forces-in-ukrainian-domestic-politics-made-civil-war-inevitable,Disinfo: Involvement of external forces in Ukrainian domestic politics made civil war inevitable,DATE OF PUBLICATION: 23/08/2021,"Keywords: War in Ukraine, Civil war, Ukrainian statehood, Puppets, Donbas, Eastern Ukraine, Ukrainian disintegration"
1653633799-773,https://euvsdisinfo.eu/disinformation-cases/?text=&date=&disinfo_countries%5B0%5D=77547&per_page=100&offset=500,"Ukrainian independence is a fake, it is a decoration and a Potemkin village",https://euvsdisinfo.eu/report/ukrainian-independence-is-a-fake-it-is-a-decoration-and-a-potemkin-village,"Disinfo: Ukrainian independence is a fake, it is a decoration and a Potemkin village",DATE OF PUBLICATION: 18/08/2021,"Keywords: Ukraine, Ukrainian statehood, Ukrainian disintegration"
1653633977-836,https://euvsdisinfo.eu/disinformation-cases/?text=&date=&disinfo_countries%5B0%5D=77547&per_page=100&offset=500,There is good reason to believe that biological weapons are developed in American laboratories,https://euvsdisinfo.eu/report/there-is-good-reason-to-believe-that-biological-weapons-are-developed-in-american-laboratories,Disinfo: There is good reason to believe that biological weapons are developed in American laboratories,DATE OF PUBLICATION: 06/09/2021,"Keywords: laboratory, Lugar Laboratory, Biological weapons, Encircling Russia"
1653633946-825,https://euvsdisinfo.eu/disinformation-cases/?text=&date=&disinfo_countries%5B0%5D=77547&per_page=100&offset=500,Political disagreements are behind the halt of the NATO-Russia Council,https://euvsdisinfo.eu/report/political-disagreements-are-behind-the-halt-of-the-nato-russia-council,Disinfo: Political disagreements are behind the halt of the NATO-Russia Council,DATE OF PUBLICATION: 02/09/2021,"Keywords: NATO, security threat, War in Ukraine, Ukrainian statehood, Crimea, International Law"
1653633729-748,https://euvsdisinfo.eu/disinformation-cases/?text=&date=&disinfo_countries%5B0%5D=77547&per_page=100&offset=500,"Death in Kyiv, defection at the Tokyo Olympics and refugees in Lithuania may all be setups against Belarus",https://euvsdisinfo.eu/report/death-in-kyiv-defection-at-the-tokyo-olympics-and-refugees-in-lithuania-may-all-be-setups-against-belarus,"Disinfo: Death in Kyiv, defection at the Tokyo Olympics and refugees in Lithuania may all be setups against Belarus",DATE OF PUBLICATION: 09/08/2021,"Keywords: Olympics, Crime, Alexander Lukashenko, Refugees"
1653633952-827,https://euvsdisinfo.eu/disinformation-cases/?text=&date=&disinfo_countries%5B0%5D=77547&per_page=100&offset=500,Russia is not part of the conflict in Donbas,https://euvsdisinfo.eu/report/russia-is-not-part-of-the-conflict-in-donbas,Disinfo: Russia is not part of the conflict in Donbas,DATE OF PUBLICATION: 02/09/2021,"Keywords: Donbas, War in Ukraine, Eastern Ukraine, Viktor Yanukovych, Euromaidan, illegal annexation, Civil war, Ukrainian statehood"
1653633754-757,https://euvsdisinfo.eu/disinformation-cases/?text=&date=&disinfo_countries%5B0%5D=77547&per_page=100&offset=500,Russia does not interfere in other countries’ internal affairs,https://euvsdisinfo.eu/report/russia-does-not-interfere-in-other-countries-internal-affairs,Disinfo: Russia does not interfere in other countries’ internal affairs,DATE OF PUBLICATION: 14/08/2021,"Keywords: election meddling, Manipulated elections/referendum"
1653633751-756,https://euvsdisinfo.eu/disinformation-cases/?text=&date=&disinfo_countries%5B0%5D=77547&per_page=100&offset=500,Ukraine launched a military operation against LPR and DPR after they declared independence,https://euvsdisinfo.eu/report/ukraine-launched-a-military-operation-against-lpr-and-dpr-after-they-declared-independence,Disinfo: Ukraine launched a military operation against LPR and DPR after they declared independence,DATE OF PUBLICATION: 13/08/2021,"Keywords: Coup, Donetsk, LPR, DPR, Donbas, Civil war"
1653633763-760,https://euvsdisinfo.eu/disinformation-cases/?text=&date=&disinfo_countries%5B0%5D=77547&per_page=100&offset=500,Afghanistan shows that the US is failing in achieving its foreign goals,https://euvsdisinfo.eu/report/afghanistan-shows-that-the-us-is-failing-in-achieving-its-foreign-goals,Disinfo: Afghanistan shows that the US is failing in achieving its foreign goals,DATE OF PUBLICATION: 16/08/2021,"Keywords: Colour revolutions, USSR, Coup, Conspiracy theory, Human rights, Democracy"
1653633986-839,https://euvsdisinfo.eu/disinformation-cases/?text=&date=&disinfo_countries%5B0%5D=77547&per_page=100&offset=500,Russophobia has become an official ideology in Ukraine,https://euvsdisinfo.eu/report/russophobia-has-become-an-official-ideology-in-ukraine,Disinfo: Russophobia has become an official ideology in Ukraine,DATE OF PUBLICATION: 08/09/2021,"Keywords: Russophobia, Anti-Russian, Ukraine"
1653633884-803,https://euvsdisinfo.eu/disinformation-cases/?text=&date=&disinfo_countries%5B0%5D=77547&per_page=100&offset=500,West’s support for Ukraine fosters Russophobia,https://euvsdisinfo.eu/report/wests-support-for-ukraine-fosters-russophobia,Disinfo: West’s support for Ukraine fosters Russophobia,DATE OF PUBLICATION: 25/08/2021,"Keywords: Donbas, War in Ukraine, Anti-Russian, Russophobia"
1653633975-835,https://euvsdisinfo.eu/disinformation-cases/?text=&date=&disinfo_countries%5B0%5D=77547&per_page=100&offset=500,"Russia not bound by Minsk deals, only Ukraine and DNR/LNR are warring sides",https://euvsdisinfo.eu/report/russia-not-bound-by-minsk-deals-only-ukraine-and-dnr-lnr-are-warring-sides,"Disinfo: Russia not bound by Minsk deals, only Ukraine and DNR/LNR are warring sides",DATE OF PUBLICATION: 06/09/2021,"Keywords: Minsk agreements, War in Ukraine, OSCE, DNR, LNR, Eastern Ukraine"
1653633737-751,https://euvsdisinfo.eu/disinformation-cases/?text=&date=&disinfo_countries%5B0%5D=77547&per_page=100&offset=500,Constitution bans foreign troops in Ukraine,https://euvsdisinfo.eu/report/constitution-bans-foreign-troops-in-ukraine,Disinfo: Constitution bans foreign troops in Ukraine,DATE OF PUBLICATION: 12/08/2021,"Keywords: NATO, EU/NATO enlargement, War in Ukraine, Military"
1653633958-829,https://euvsdisinfo.eu/disinformation-cases/?text=&date=&disinfo_countries%5B0%5D=77547&per_page=100&offset=500,It is in the West's interest to keep under control Ukraine that will always bark at Russia,https://euvsdisinfo.eu/report/it-is-in-the-wests-interest-to-keep-under-control-ukraine-that-will-always-bark-at-russia,Disinfo: It is in the West's interest to keep under control Ukraine that will always bark at Russia,DATE OF PUBLICATION: 02/09/2021,"Keywords: Ukrainian statehood, Puppets, Donbas, West, Nazi/Fascist"
1653633929-819,https://euvsdisinfo.eu/disinformation-cases/?text=&date=&disinfo_countries%5B0%5D=77547&per_page=100&offset=500,Crimea Platform was a staged show,https://euvsdisinfo.eu/report/crimea-platform-was-a-staged-show,Disinfo: Crimea Platform was a staged show,DATE OF PUBLICATION: 30/08/2021,"Keywords: Crimea, illegal annexation, G7, G20, Abandoned Ukraine, Occupation"
1653633836-786,https://euvsdisinfo.eu/disinformation-cases/?text=&date=&disinfo_countries%5B0%5D=77547&per_page=100&offset=500,"The US, NATO, and intelligence services of the UK are behind Crimean Platform",https://euvsdisinfo.eu/report/the-us-nato-and-intelligence-services-of-the-uk-are-behind-crimean-platform,"Disinfo: The US, NATO, and intelligence services of the UK are behind Crimean Platform",DATE OF PUBLICATION: 22/08/2021,"Keywords: West, Crimea, Nazi/Fascist, Intelligence services, NATO"
1653633921-816,https://euvsdisinfo.eu/disinformation-cases/?text=&date=&disinfo_countries%5B0%5D=77547&per_page=100&offset=500,"Ukraine is a quasi-state, a pro-Western appendage that cannot decide its own fate",https://euvsdisinfo.eu/report/ukraine-is-a-quasi-state-a-pro-western-appendage-that-cannot-decide-its-own-fate,"Disinfo: Ukraine is a quasi-state, a pro-Western appendage that cannot decide its own fate",DATE OF PUBLICATION: 29/08/2021,Keywords: Ukrainian statehood
1653633955-828,https://euvsdisinfo.eu/disinformation-cases/?text=&date=&disinfo_countries%5B0%5D=77547&per_page=100&offset=500,Colour revolutions led countries to captivity rather than freedom,https://euvsdisinfo.eu/report/colour-revolutions-led-countries-to-captivity-rather-than-freedom,Disinfo: Colour revolutions led countries to captivity rather than freedom,DATE OF PUBLICATION: 02/09/2021,"Keywords: Colour revolutions, IMF, NATO, Democracy, Euromaidan, Coup"
1653633720-745,https://euvsdisinfo.eu/disinformation-cases/?text=&date=&disinfo_countries%5B0%5D=77547&per_page=100&offset=500,The EU is looting Ukraine,https://euvsdisinfo.eu/report/the-eu-is-looting-ukraine,Disinfo: The EU is looting Ukraine,DATE OF PUBLICATION: 09/08/2021,"Keywords: Energy, Imperialism/colonialism, Economic difficulties, Ukraine"
1653633712-742,https://euvsdisinfo.eu/disinformation-cases/?text=&date=&disinfo_countries%5B0%5D=77547&per_page=100&offset=500,Zelenskyy would relocate Russians from Donbas,https://euvsdisinfo.eu/report/zelenskyy-would-relocate-russians-from-donbas,Disinfo: Zelenskyy would relocate Russians from Donbas,DATE OF PUBLICATION: 08/08/2021,"Keywords: Donbas, Ethnic Russians, Russophobia, Eastern Ukraine, Volodymyr Zelensky"
1653633791-770,https://euvsdisinfo.eu/disinformation-cases/?text=&date=&disinfo_countries%5B0%5D=77547&per_page=100&offset=500,US caused 2014 Ukraine coup d'etat,https://euvsdisinfo.eu/report/us-caused-2014-ukraine-coup-detat,Disinfo: US caused 2014 Ukraine coup d'etat,DATE OF PUBLICATION: 17/08/2021,"Keywords: Euromaidan, Coup, illegal annexation, Crimea, Diplomacy with Russia"
1653633768-762,https://euvsdisinfo.eu/disinformation-cases/?text=&date=&disinfo_countries%5B0%5D=77547&per_page=100&offset=500,US protégés in Ukraine will have to flee like Ashraf Ghani,https://euvsdisinfo.eu/report/us-proteges-in-ukraine-will-have-to-flee-like-ashraf-ghani,Disinfo: US protégés in Ukraine will have to flee like Ashraf Ghani,DATE OF PUBLICATION: 17/08/2021,"Keywords: Puppets, Ukrainian statehood"
1653633748-755,https://euvsdisinfo.eu/disinformation-cases/?text=&date=&disinfo_countries%5B0%5D=77547&per_page=100&offset=500,Ukrainians and Kazakhs did not exist as ethnic groups before the USSR,https://euvsdisinfo.eu/report/ukrainians-and-kazakhs-did-not-exist-as-ethnic-groups-before-the-ussr,Disinfo: Ukrainians and Kazakhs did not exist as ethnic groups before the USSR,DATE OF PUBLICATION: 13/08/2021,"Keywords: Russophobia, Anti-Russian, Ukrainian statehood, Ukraine, Central Asia, USSR, Historical revisionism"
1653633844-789,https://euvsdisinfo.eu/disinformation-cases/?text=&date=&disinfo_countries%5B0%5D=77547&per_page=100&offset=500,Ukraine an example of failure and strengthening external control,https://euvsdisinfo.eu/report/ukraine-an-example-of-failure-and-strengthening-external-control,Disinfo: Ukraine an example of failure and strengthening external control,DATE OF PUBLICATION: 23/08/2021,"Keywords: Sovereignty, Ukrainian statehood, Puppets"
1653633966-832,https://euvsdisinfo.eu/disinformation-cases/?text=&date=&disinfo_countries%5B0%5D=77547&per_page=100&offset=500,"International community should recognise the fact of the civil war in Ukraine, which is destroying its own population",https://euvsdisinfo.eu/report/international-community-should-recognise-the-fact-of-the-civil-war-in-ukraine-which-is-destroying-its-own-population,"Disinfo: International community should recognise the fact of the civil war in Ukraine, which is destroying its own population",DATE OF PUBLICATION: 03/09/2021,"Keywords: Donbas, Civil war, Eastern Ukraine, War in Ukraine"
1653633980-837,https://euvsdisinfo.eu/disinformation-cases/?text=&date=&disinfo_countries%5B0%5D=77547&per_page=100&offset=500,Polish politicians accept all crimes of the Ukrainian nationalists in order to keep them anti-Russian,https://euvsdisinfo.eu/report/polish-politicians-accept-all-crimes-of-the-ukrainian-nationalists-in-order-to-keep-them-anti-russian,Disinfo: Polish politicians accept all crimes of the Ukrainian nationalists in order to keep them anti-Russian,DATE OF PUBLICATION: 06/09/2021,"Keywords: Stepan Bandera, Nazi/Fascist, Anti-Russian, Russophobia, Anti-Semitism"
1653633864-796,https://euvsdisinfo.eu/disinformation-cases/?text=&date=&disinfo_countries%5B0%5D=77547&per_page=100&offset=500,Geopolitics was the driver behind Ukrainian Church Autocephaly,https://euvsdisinfo.eu/report/geopolitics-was-the-driver-behind-ukrainian-church-autocephaly,Disinfo: Geopolitics was the driver behind Ukrainian Church Autocephaly,DATE OF PUBLICATION: 24/08/2021,"Keywords: Orthodox Church, autocephaly, Sergei Lavrov"
1653633709-741,https://euvsdisinfo.eu/disinformation-cases/?text=&date=&disinfo_countries%5B0%5D=77547&per_page=100&offset=500,The Netherlands is complicit in the MH17 downing,https://euvsdisinfo.eu/report/the-netherlands-is-complicit-in-the-mh17-downing,Disinfo: The Netherlands is complicit in the MH17 downing,DATE OF PUBLICATION: 08/08/2021,Keywords: MH17
1653633887-804,https://euvsdisinfo.eu/disinformation-cases/?text=&date=&disinfo_countries%5B0%5D=77547&per_page=100&offset=500,The West funded the Ukrainian coup with $5 billion,https://euvsdisinfo.eu/report/the-west-funded-the-ukrainian-coup-with-5-billion,Disinfo: The West funded the Ukrainian coup with $5 billion,DATE OF PUBLICATION: 25/08/2021,"Keywords: Russophobia, Coup, West, Ukraine"
1653633918-815,https://euvsdisinfo.eu/disinformation-cases/?text=&date=&disinfo_countries%5B0%5D=77547&per_page=100&offset=500,The Eastern European “limitrophes” are geopolitical scum unable to protect their borders,https://euvsdisinfo.eu/report/the-eastern-european-limitrophes-are-geopolitical-scum-unable-to-protect-their-borders,Disinfo: The Eastern European “limitrophes” are geopolitical scum unable to protect their borders,DATE OF PUBLICATION: 29/08/2021,"Keywords: Eastern Europe, Puppets, Sovereignty, Anti-Russian, Refugees, Migration crisis, coronavirus, Russophobia"
1653633715-743,https://euvsdisinfo.eu/disinformation-cases/?text=&date=&disinfo_countries%5B0%5D=77547&per_page=100&offset=500,Crimea is a primordially Russian land,https://euvsdisinfo.eu/report/crimea-is-a-primordially-russian-land,Disinfo: Crimea is a primordially Russian land,DATE OF PUBLICATION: 08/08/2021,"Keywords: Crimea, illegal annexation, Referendum, Manipulated elections/referendum, Historical revisionism"
1653633757-758,https://euvsdisinfo.eu/disinformation-cases/?text=&date=&disinfo_countries%5B0%5D=77547&per_page=100&offset=500,Ukraine approached the anniversary of independence in the status of a colony under external control,https://euvsdisinfo.eu/report/ukraine-approached-the-anniversary-of-independence-in-the-status-of-a-colony-under-external-control,Disinfo: Ukraine approached the anniversary of independence in the status of a colony under external control,DATE OF PUBLICATION: 14/08/2021,"Keywords: Ukrainian statehood, Sovereignty, Puppets"
1653633794-771,https://euvsdisinfo.eu/disinformation-cases/?text=&date=&disinfo_countries%5B0%5D=77547&per_page=100&offset=500,British warship HMS Defender deliberately entered Russian territorial waters,https://euvsdisinfo.eu/report/british-warship-hms-defender-deliberately-entered-russian-territorial-waters,Disinfo: British warship HMS Defender deliberately entered Russian territorial waters,DATE OF PUBLICATION: 17/08/2021,"Keywords: Crimea, Occupation, Provocation, Black Sea, International Law"
1653633941-823,https://euvsdisinfo.eu/disinformation-cases/?text=&date=&disinfo_countries%5B0%5D=77547&per_page=100&offset=500,"The US is responsible for Ukrainian tragedy, which followed after the coup in 2014",https://euvsdisinfo.eu/report/the-us-is-responsible-for-ukrainian-tragedy-which-followed-after-the-coup-in-2014,"Disinfo: The US is responsible for Ukrainian tragedy, which followed after the coup in 2014",DATE OF PUBLICATION: 01/09/2021,"Keywords: Coup, Euromaidan, Ukrainian statehood, War in Ukraine, Barack Obama"
1653633740-752,https://euvsdisinfo.eu/disinformation-cases/?text=&date=&disinfo_countries%5B0%5D=77547&per_page=100&offset=500,The West position towards Crimea is offending its free will,https://euvsdisinfo.eu/report/the-west-position-towards-crimea-is-offending-its-free-will,Disinfo: The West position towards Crimea is offending its free will,DATE OF PUBLICATION: 12/08/2021,"Keywords: West, Crime, illegal annexation, Ukrainian statehood, UN, Manipulated elections/referendum, Sovereignty, Territorial dispute, International Law, Coup, Euromaidan, Anti-Russian, Russian language"
1653633805-775,https://euvsdisinfo.eu/disinformation-cases/?text=&date=&disinfo_countries%5B0%5D=77547&per_page=100&offset=500,Kyiv is an anti-Russian puppet in the geopolitical games of the US and NATO,https://euvsdisinfo.eu/report/kyiv-is-an-anti-russian-puppet-in-the-geopolitical-games-of-the-us-and-nato,Disinfo: Kyiv is an anti-Russian puppet in the geopolitical games of the US and NATO,DATE OF PUBLICATION: 18/08/2021,"Keywords: NATO, EU/NATO enlargement, Puppets, Ukrainian statehood, West, Anti-Russian, Military exercise"
1653633827-783,https://euvsdisinfo.eu/disinformation-cases/?text=&date=&disinfo_countries%5B0%5D=77547&per_page=100&offset=500,Ukraine is a failed state because its economic model is not viable,https://euvsdisinfo.eu/report/ukraine-is-a-failed-state-because-its-economic-model-is-not-viable,Disinfo: Ukraine is a failed state because its economic model is not viable,DATE OF PUBLICATION: 20/08/2021,"Keywords: Economic difficulties, Ukrainian statehood, Anti-Russian"
1653633760-759,https://euvsdisinfo.eu/disinformation-cases/?text=&date=&disinfo_countries%5B0%5D=77547&per_page=100&offset=500,The US will flee Ukraine the way it is leaving Afghanistan,https://euvsdisinfo.eu/report/the-us-will-flee-ukraine-the-way-it-is-leaving-afghanistan,Disinfo: The US will flee Ukraine the way it is leaving Afghanistan,DATE OF PUBLICATION: 15/08/2021,"Keywords: Military, Donbas, Abandoned Ukraine"
1653633822-781,https://euvsdisinfo.eu/disinformation-cases/?text=&date=&disinfo_countries%5B0%5D=77547&per_page=100&offset=500,"Ukraine’s Crimea Platform is futile, joining Russia was people’s will",https://euvsdisinfo.eu/report/ukraines-crimea-platform-is-futile-joining-russia-was-peoples-will,"Disinfo: Ukraine’s Crimea Platform is futile, joining Russia was people’s will",DATE OF PUBLICATION: 19/08/2021,"Keywords: Crimea, Referendum, Sanctions, illegal annexation"
1653633810-777,https://euvsdisinfo.eu/disinformation-cases/?text=&date=&disinfo_countries%5B0%5D=77547&per_page=100&offset=500,Afghan scenario could repeat itself in Ukraine,https://euvsdisinfo.eu/report/afghan-scenario-could-repeat-itself-in-ukraine,Disinfo: Afghan scenario could repeat itself in Ukraine,DATE OF PUBLICATION: 19/08/2021,Keywords: Nazi/Fascist
1653633765-761,https://euvsdisinfo.eu/disinformation-cases/?text=&date=&disinfo_countries%5B0%5D=77547&per_page=100&offset=500,Ukrainian Nazis are equivalent to Taliban,https://euvsdisinfo.eu/report/ukrainian-nazis-are-equivalent-to-taliban,Disinfo: Ukrainian Nazis are equivalent to Taliban,DATE OF PUBLICATION: 16/08/2021,Keywords: Nazi/Fascist
1653633842-788,https://euvsdisinfo.eu/disinformation-cases/?text=&date=&disinfo_countries%5B0%5D=77547&per_page=100&offset=500,Ukraine wants to take away Crimea from Russia with the support of Russophobes,https://euvsdisinfo.eu/report/ukraine-wants-to-take-away-crimea-from-russia-with-the-support-of-russophobes,Disinfo: Ukraine wants to take away Crimea from Russia with the support of Russophobes,DATE OF PUBLICATION: 23/08/2021,"Keywords: Crimea, Russophobia, Anti-Russian, illegal annexation"
1653633745-754,https://euvsdisinfo.eu/disinformation-cases/?text=&date=&disinfo_countries%5B0%5D=77547&per_page=100&offset=500,West condones Kyiv’s killings in Donbas,https://euvsdisinfo.eu/report/west-condones-kyivs-killings-in-donbas,Disinfo: West condones Kyiv’s killings in Donbas,DATE OF PUBLICATION: 12/08/2021,"Keywords: Donbas, War in Ukraine, Minsk agreements"
