web-scraper-order,web-scraper-start-url,disinfo-case-link,disinfo-case-link-href,title,date,keywords
1653635969-1209,https://euvsdisinfo.eu/disinformation-cases/?text=&date=&disinfo_countries%5B0%5D=77547&per_page=100&offset=900,"Euromaidan coup led to Crimea referendum, civil war in Donbas",https://euvsdisinfo.eu/report/euromaidan-coup-led-to-crimea-referendum-civil-war-in-donbas,"Disinfo: Euromaidan coup led to Crimea referendum, civil war in Donbas",DATE OF PUBLICATION: 06/05/2021,"Keywords: Coup, Civil war, War in Ukraine, Viktor Yanukovych, Euromaidan, Crimea, Donbas, Eastern Ukraine, illegal annexation, Manipulated elections/referendum"
1653635952-1203,https://euvsdisinfo.eu/disinformation-cases/?text=&date=&disinfo_countries%5B0%5D=77547&per_page=100&offset=900,70 per cent of Ukrainians sure that jabbing has failed over refusal of Sputnik V,https://euvsdisinfo.eu/report/70-per-cent-of-ukrainians-sure-that-jabbing-has-failed-over-refusal-of-sputnik-v,Disinfo: 70 per cent of Ukrainians sure that jabbing has failed over refusal of Sputnik V,DATE OF PUBLICATION: 05/05/2021,"Keywords: coronavirus, Sputnik V, vaccination"
1653635765-1145,https://euvsdisinfo.eu/disinformation-cases/?text=&date=&disinfo_countries%5B0%5D=77547&per_page=100&offset=900,Mainstream Polish parties compete in their aggressive position on Russia and Belarus,https://euvsdisinfo.eu/report/mainstream-polish-parties-compete-in-their-aggressive-position-on-russia-and-belarus,Disinfo: Mainstream Polish parties compete in their aggressive position on Russia and Belarus,DATE OF PUBLICATION: 19/04/2021,"Keywords: NATO, Anti-Russian, Puppets, Eastern Ukraine, War in Ukraine, US presence in Europe"
1653635866-1173,https://euvsdisinfo.eu/disinformation-cases/?text=&date=&disinfo_countries%5B0%5D=77547&per_page=100&offset=900,US supports Kyiv in deploying Ukrainian regular troops in Donbas,https://euvsdisinfo.eu/report/us-supports-kyiv-in-deploying-ukrainian-regular-troops-in-donbas,Disinfo: US supports Kyiv in deploying Ukrainian regular troops in Donbas,DATE OF PUBLICATION: 27/04/2021,"Keywords: Eastern Ukraine, Donbas, Ukrainian statehood"
1653636007-1219,https://euvsdisinfo.eu/disinformation-cases/?text=&date=&disinfo_countries%5B0%5D=77547&per_page=100&offset=900,Polish elites try to put Poland in the row of the countries which collaborated with Nazis,https://euvsdisinfo.eu/report/polish-elites-try-to-put-poland-in-the-row-of-the-countries-which-collaborated-with-nazis,Disinfo: Polish elites try to put Poland in the row of the countries which collaborated with Nazis,DATE OF PUBLICATION: 08/05/2021,"Keywords: Historical revisionism, WWII, Nazi/Fascist, Adolf Hitler, Baltic states"
1653635809-1154,https://euvsdisinfo.eu/disinformation-cases/?text=&date=&disinfo_countries%5B0%5D=77547&per_page=100&offset=900,The West and Soros behind Orange Revolution,https://euvsdisinfo.eu/report/the-west-and-soros-behind-orange-revolution,Disinfo: The West and Soros behind Orange Revolution,DATE OF PUBLICATION: 20/04/2021,"Keywords: Colour revolutions, George Soros, Protest, West"
1653635869-1174,https://euvsdisinfo.eu/disinformation-cases/?text=&date=&disinfo_countries%5B0%5D=77547&per_page=100&offset=900,Washington is sick with clientitis: The US is supporting SS Nazis and their allies in Ukraine,https://euvsdisinfo.eu/report/washington-is-sick-with-clientitis-the-us-is-supporting-ss-nazis-and-their-allies-in-ukraine,Disinfo: Washington is sick with clientitis: The US is supporting SS Nazis and their allies in Ukraine,DATE OF PUBLICATION: 27/04/2021,"Keywords: Eastern Ukraine, War in Ukraine, Nazi/Fascist, Barack Obama, Euromaidan, Democratic Party (US)"
1653635904-1186,https://euvsdisinfo.eu/disinformation-cases/?text=&date=&disinfo_countries%5B0%5D=77547&per_page=100&offset=900,Ukrainian authorities allowed Nazis' demostrations,https://euvsdisinfo.eu/report/ukrainian-authorities-allowed-nazis-demostrations,Disinfo: Ukrainian authorities allowed Nazis' demostrations,DATE OF PUBLICATION: 01/05/2021,"Keywords: Nazi/Fascist, Ukraine"
1653635998-1216,https://euvsdisinfo.eu/disinformation-cases/?text=&date=&disinfo_countries%5B0%5D=77547&per_page=100&offset=900,"Civil war is going on in Ukraine, Russia is not party to conflict",https://euvsdisinfo.eu/report/civil-war-is-going-on-in-ukraine-russia-is-not-party-to-conflict,"Disinfo: Civil war is going on in Ukraine, Russia is not party to conflict",DATE OF PUBLICATION: 07/05/2021,"Keywords: Donbas, War in Ukraine, Minsk agreements, Ukrainian statehood"
1653636027-1226,https://euvsdisinfo.eu/disinformation-cases/?text=&date=&disinfo_countries%5B0%5D=77547&per_page=100&offset=900,Ukraine is moving from external control to full submission to the interests of the United States,https://euvsdisinfo.eu/report/ukraine-is-moving-from-external-control-to-full-submission-to-the-interests-of-the-united-states,Disinfo: Ukraine is moving from external control to full submission to the interests of the United States,DATE OF PUBLICATION: 13/05/2021,"Keywords: Volodymyr Zelensky, Joe Biden, Ukrainian statehood, Ukrainian disintegration"
1653635858-1170,https://euvsdisinfo.eu/disinformation-cases/?text=&date=&disinfo_countries%5B0%5D=77547&per_page=100&offset=900,Ukrainian foreign policy consists of obeying America,https://euvsdisinfo.eu/report/ukrainian-foreign-policy-consists-of-obeying-america,Disinfo: Ukrainian foreign policy consists of obeying America,DATE OF PUBLICATION: 26/04/2021,"Keywords: Ukrainian statehood, US presence in Europe, Ukraine, Anti-Russian"
1653635851-1168,https://euvsdisinfo.eu/disinformation-cases/?text=&date=&disinfo_countries%5B0%5D=77547&per_page=100&offset=900,Donbas war is an internal Ukrainian conflict,https://euvsdisinfo.eu/report/donbas-war-was-an-internal-ukrainian-conflict,Disinfo: Donbas war is an internal Ukrainian conflict,DATE OF PUBLICATION: 25/04/2021,"Keywords: War in Ukraine, Donbas, Eastern Ukraine, Russian expansionism"
1653635938-1198,https://euvsdisinfo.eu/disinformation-cases/?text=&date=&disinfo_countries%5B0%5D=77547&per_page=100&offset=900,"On May 2, 2014, Ukrainian fascists executed 48 residents of Odessa",https://euvsdisinfo.eu/report/on-may-2-2014-ukrainian-fascists-executed-48-residents-of-odessa,"Disinfo: On May 2, 2014, Ukrainian fascists executed 48 residents of Odessa",DATE OF PUBLICATION: 04/05/2021,"Keywords: Odessa tragedy, Ukraine"
1653635886-1180,https://euvsdisinfo.eu/disinformation-cases/?text=&date=&disinfo_countries%5B0%5D=77547&per_page=100&offset=900,Ukraine is a testing ground for struggle between Russian and European vaccines,https://euvsdisinfo.eu/report/ukraine-is-a-testing-ground-for-struggle-between-russian-and-european-vaccines,Disinfo: Ukraine is a testing ground for struggle between Russian and European vaccines,DATE OF PUBLICATION: 28/04/2021,"Keywords: coronavirus, Ukrainian statehood, health, Sputnik"
1653635981-1210,https://euvsdisinfo.eu/disinformation-cases/?text=&date=&disinfo_countries%5B0%5D=77547&per_page=100&offset=900,Washington is only pushing Kyiv to more and more aggressive actions,https://euvsdisinfo.eu/report/washington-is-only-pushing-kyiv-to-more-and-more-aggressive-actions,Disinfo: Washington is only pushing Kyiv to more and more aggressive actions,DATE OF PUBLICATION: 06/05/2021,"Keywords: Military, Minsk agreements, Donbas, War in Ukraine, security threat"
1653635854-1169,https://euvsdisinfo.eu/disinformation-cases/?text=&date=&disinfo_countries%5B0%5D=77547&per_page=100&offset=900,Gauleiter Biden and the US were behind the Orange revolution 2004 and the coup of 2014,https://euvsdisinfo.eu/report/gauleiter-biden-and-the-us-were-behind-the-orange-revolution-2004-and-the-coup-of-2014,Disinfo: Gauleiter Biden and the US were behind the Orange revolution 2004 and the coup of 2014,DATE OF PUBLICATION: 25/04/2021,"Keywords: Joe Biden, War in Ukraine, Euromaidan, Crimea, Donbas"
1653635943-1200,https://euvsdisinfo.eu/disinformation-cases/?text=&date=&disinfo_countries%5B0%5D=77547&per_page=100&offset=900,Poland sees in Ukraine a part of its territory,https://euvsdisinfo.eu/report/poland-sees-in-ukraine-a-part-of-its-territory,Disinfo: Poland sees in Ukraine a part of its territory,DATE OF PUBLICATION: 05/05/2021,"Keywords: Ukrainian statehood, Ukrainian disintegration"
1653635906-1187,https://euvsdisinfo.eu/disinformation-cases/?text=&date=&disinfo_countries%5B0%5D=77547&per_page=100&offset=900,Ukraine launched a military operation against those who opposed the coup in 2014,https://euvsdisinfo.eu/report/ukraine-launched-a-military-operation-against-those-who-opposed-the-coup-in-2014,Disinfo: Ukraine launched a military operation against those who opposed the coup in 2014,DATE OF PUBLICATION: 01/05/2021,"Keywords: Eastern Ukraine, War in Ukraine, DNR, LNR, Civil war, Euromaidan, Coup, Ukrainian statehood, Donetsk"
1653635984-1211,https://euvsdisinfo.eu/disinformation-cases/?text=&date=&disinfo_countries%5B0%5D=77547&per_page=100&offset=900,The United States is using Ukraine as a weapon against Russia,https://euvsdisinfo.eu/report/the-united-states-is-using-ukraine-as-a-weapon-against-russia,Disinfo: The United States is using Ukraine as a weapon against Russia,DATE OF PUBLICATION: 06/05/2021,"Keywords: War in Ukraine, Donbas, Volodymyr Zelensky, Minsk agreements"
1653635889-1181,https://euvsdisinfo.eu/disinformation-cases/?text=&date=&disinfo_countries%5B0%5D=77547&per_page=100&offset=900,The West using Ukraine as a tool to undermine peace and security in the Black Sea region,https://euvsdisinfo.eu/report/the-west-using-ukraine-as-a-tool-to-undermine-peace-and-security-in-the-black-sea-region,Disinfo: The West using Ukraine as a tool to undermine peace and security in the Black Sea region,DATE OF PUBLICATION: 29/04/2021,"Keywords: West, security threat, Crimea, Black Sea, Anti-Russian"
1653635863-1172,https://euvsdisinfo.eu/disinformation-cases/?text=&date=&disinfo_countries%5B0%5D=77547&per_page=100&offset=900,Zelensky needs to give explanations to Washington after each of his acts,https://euvsdisinfo.eu/report/zelensky-needs-to-give-explanations-to-washington-after-each-of-his-acts,Disinfo: Zelensky needs to give explanations to Washington after each of his acts,DATE OF PUBLICATION: 27/04/2021,"Keywords: Ukraine, Ukrainian statehood"
1653635960-1206,https://euvsdisinfo.eu/disinformation-cases/?text=&date=&disinfo_countries%5B0%5D=77547&per_page=100&offset=900,Brussels destroyed an effective system of international cooperation by supporting the coup d'etat in Ukraine,https://euvsdisinfo.eu/report/brussels-destroyed-an-effective-system-of-international-cooperation-by-supporting-the-coup-detat-in-ukraine,Disinfo: Brussels destroyed an effective system of international cooperation by supporting the coup d'etat in Ukraine,DATE OF PUBLICATION: 06/05/2021,"Keywords: Coup, Viktor Yanukovych, Diplomacy with Russia, Sanctions, Anti-Russian"
1653635892-1182,https://euvsdisinfo.eu/disinformation-cases/?text=&date=&disinfo_countries%5B0%5D=77547&per_page=100&offset=900,Crimean referendum and secession from Ukraine fully complied with Article 138 of the Constitution of Ukraine,https://euvsdisinfo.eu/report/crimean-referendum-and-secession-from-ukraine-fully-complied-with-article-138-of-the-constitution-of-ukraine,Disinfo: Crimean referendum and secession from Ukraine fully complied with Article 138 of the Constitution of Ukraine,DATE OF PUBLICATION: 29/04/2021,"Keywords: Crimea, illegal annexation, Referendum, Manipulated elections/referendum"
1653636070-1241,https://euvsdisinfo.eu/disinformation-cases/?text=&date=&disinfo_countries%5B0%5D=77547&per_page=100&offset=900,Ukraine is ruled by the West,https://euvsdisinfo.eu/report/ukraine-is-ruled-by-the-west,Disinfo: Ukraine is ruled by the West,DATE OF PUBLICATION: 18/05/2021,"Keywords: Ukrainian disintegration, Ukrainian statehood, West, IMF"
1653635860-1171,https://euvsdisinfo.eu/disinformation-cases/?text=&date=&disinfo_countries%5B0%5D=77547&per_page=100&offset=900,Biological weapons are being developed in US-controlled biological laboratories around the world,https://euvsdisinfo.eu/report/biological-weapons-are-being-developed-in-us-controlled-biological-laboratories-around-the-world,Disinfo: Biological weapons are being developed in US-controlled biological laboratories around the world,DATE OF PUBLICATION: 26/04/2021,"Keywords: Biological weapons, Lugar Laboratory, laboratory, Conspiracy theory"
1653636579-1286,https://euvsdisinfo.eu/disinformation-cases/?text=&date=&disinfo_countries%5B0%5D=77547&per_page=100&offset=1000,US bio labs in Ukraine and Georgia conduct dangerous and non-transparent research,https://euvsdisinfo.eu/report/us-bio-labs-in-ukraine-and-georgia-conduct-dangerous-and-non-transparent-research,Disinfo: US bio labs in Ukraine and Georgia conduct dangerous and non-transparent research,DATE OF PUBLICATION: 10/04/2021,"Keywords: Biological weapons, fake news"
1653636489-1254,https://euvsdisinfo.eu/disinformation-cases/?text=&date=&disinfo_countries%5B0%5D=77547&per_page=100&offset=1000,Zelenskyy is unable to make independent decisions and dances to the tune of the US,https://euvsdisinfo.eu/report/zelenskyy-is-unable-to-make-independent-decisions-and-dances-to-the-tune-of-the-us,Disinfo: Zelenskyy is unable to make independent decisions and dances to the tune of the US,DATE OF PUBLICATION: 06/04/2021,"Keywords: Donbas, Volodymyr Zelensky, Sanctions, Military"
1653636708-1330,https://euvsdisinfo.eu/disinformation-cases/?text=&date=&disinfo_countries%5B0%5D=77547&per_page=100&offset=1000,US biolabs have been developing new biological weapons in Ukraine,https://euvsdisinfo.eu/report/us-biolabs-have-been-developing-new-biological-weapons-in-ukraine,Disinfo: US biolabs have been developing new biological weapons in Ukraine,DATE OF PUBLICATION: 15/04/2021,"Keywords: Biological weapons, coronavirus"
1653636573-1284,https://euvsdisinfo.eu/disinformation-cases/?text=&date=&disinfo_countries%5B0%5D=77547&per_page=100&offset=1000,"US provokes Russia into an escalation in Donbas to impose sanctions, disrupt Nord Stream 2",https://euvsdisinfo.eu/report/us-provokes-russia-into-an-escalation-in-donbas-to-impose-sanctions-disrupt-nord-stream-2,"Disinfo: US provokes Russia into an escalation in Donbas to impose sanctions, disrupt Nord Stream 2",DATE OF PUBLICATION: 09/04/2021,"Keywords: Donbas, War in Ukraine, Russophobia, Sanctions"
1653636478-1250,https://euvsdisinfo.eu/disinformation-cases/?text=&date=&disinfo_countries%5B0%5D=77547&per_page=100&offset=1000,Russia is not a party to the conflict and is not interested in a conflict with Ukraine,https://euvsdisinfo.eu/report/russia-is-not-a-party-to-the-conflict-and-is-not-interested-in-a-conflict-with-ukraine,Disinfo: Russia is not a party to the conflict and is not interested in a conflict with Ukraine,DATE OF PUBLICATION: 06/04/2021,"Keywords: War in Ukraine, Donbas, Eastern Ukraine, Russian expansionism"
1653636517-1264,https://euvsdisinfo.eu/disinformation-cases/?text=&date=&disinfo_countries%5B0%5D=77547&per_page=100&offset=1000,"After the coup in 2014, Ukraine is acting according to the dictates of the West",https://euvsdisinfo.eu/report/after-the-coup-in-2014-ukraine-is-acting-according-to-the-dictates-of-the-west,"Disinfo: After the coup in 2014, Ukraine is acting according to the dictates of the West",DATE OF PUBLICATION: 07/04/2021,"Keywords: Coup, Euromaidan, Petro Poroshenko, Volodymyr Zelensky, Ukrainian statehood"
1653636691-1324,https://euvsdisinfo.eu/disinformation-cases/?text=&date=&disinfo_countries%5B0%5D=77547&per_page=100&offset=1000,"Conflict in Ukraine is internal, Russia is not a party to it",https://euvsdisinfo.eu/report/conflict-in-ukraine-is-internal-russia-is-not-a-party-to-it,"Disinfo: Conflict in Ukraine is internal, Russia is not a party to it",DATE OF PUBLICATION: 15/04/2021,"Keywords: War in Ukraine, Donbas, Minsk agreements"
1653636685-1322,https://euvsdisinfo.eu/disinformation-cases/?text=&date=&disinfo_countries%5B0%5D=77547&per_page=100&offset=1000,Four-year-old died as a result of a drone attack by the Ukrainian Army,https://euvsdisinfo.eu/report/four-year-old-died-as-a-result-of-a-drone-attack-by-the-ukrainian-army,Disinfo: Four-year-old died as a result of a drone attack by the Ukrainian Army,DATE OF PUBLICATION: 14/04/2021,"Keywords: Donbas, War in Ukraine, DNR"
1653636643-1308,https://euvsdisinfo.eu/disinformation-cases/?text=&date=&disinfo_countries%5B0%5D=77547&per_page=100&offset=1000,The West forcibly drags Russia into war with Ukraine,https://euvsdisinfo.eu/report/the-west-forcibly-drags-russia-into-war-with-ukraine,Disinfo: The West forcibly drags Russia into war with Ukraine,DATE OF PUBLICATION: 13/04/2021,"Keywords: West, Warmongering, Crimea"
1653636548-1275,https://euvsdisinfo.eu/disinformation-cases/?text=&date=&disinfo_countries%5B0%5D=77547&per_page=100&offset=1000,"Russia wants peace in Donbas, slams Ukraine and NATO for escalation",https://euvsdisinfo.eu/report/russia-wants-peace-in-donbas-slams-ukraine-and-nato-for-escalatio,"Disinfo: Russia wants peace in Donbas, slams Ukraine and NATO for escalation",DATE OF PUBLICATION: 08/04/2021,"Keywords: Donbas, War in Ukraine, NATO, Military, Russophobia"
1653636654-1312,https://euvsdisinfo.eu/disinformation-cases/?text=&date=&disinfo_countries%5B0%5D=77547&per_page=100&offset=1000,NATO and the EU inspire Ukraine to continue with Donbas conflict,https://euvsdisinfo.eu/report/nato-and-the-eu-inspire-ukraine-to-continue-with-donbas-conflict,Disinfo: NATO and the EU inspire Ukraine to continue with Donbas conflict,DATE OF PUBLICATION: 14/04/2021,"Keywords: Donbas, War in Ukraine, NATO, Military"
1653636719-1334,https://euvsdisinfo.eu/disinformation-cases/?text=&date=&disinfo_countries%5B0%5D=77547&per_page=100&offset=1000,Russia is moving troops to defend against NATO,https://euvsdisinfo.eu/report/russia-is-moving-troops-to-defend-against-nato,Disinfo: Russia is moving troops to defend against NATO,DATE OF PUBLICATION: 16/04/2021,"Keywords: NATO, Anti-Russian, Sergey Shoigu, Military exercise"
1653636506-1260,https://euvsdisinfo.eu/disinformation-cases/?text=&date=&disinfo_countries%5B0%5D=77547&per_page=100&offset=1000,Zelenskyy tries to seize power by force to please foreign sponsors,https://euvsdisinfo.eu/report/zelenskyy-tries-to-seize-power-by-force-to-please-foreign-sponsors,Disinfo: Zelenskyy tries to seize power by force to please foreign sponsors,DATE OF PUBLICATION: 07/04/2021,"Keywords: Ukrainian statehood, Democracy, Western values, Volodymyr Zelensky"
1653636660-1313,https://euvsdisinfo.eu/disinformation-cases/?text=&date=&disinfo_countries%5B0%5D=77547&per_page=100&offset=1000,Ukraine repeatedly breaks the Minsk Agreements and arranges provocations,https://euvsdisinfo.eu/report/ukraine-repeatedly-breaks-the-minsk-agreements-and-arranges-provocations,Disinfo: Ukraine repeatedly breaks the Minsk Agreements and arranges provocations,DATE OF PUBLICATION: 14/04/2021,"Keywords: War in Ukraine, Minsk agreements, Donbas, Provocation"
1653636618-1300,https://euvsdisinfo.eu/disinformation-cases/?text=&date=&disinfo_countries%5B0%5D=77547&per_page=100&offset=1000,The US organised a coup in 2014 in Kyiv and now wants Ukraine to start a war against Russia,https://euvsdisinfo.eu/report/the-us-organised-a-coup-in-2014-in-kyiv-and-now-wants-ukraine-to-start-a-war-against-russia,Disinfo: The US organised a coup in 2014 in Kyiv and now wants Ukraine to start a war against Russia,DATE OF PUBLICATION: 12/04/2021,"Keywords: Donbas, Coup, Eastern Ukraine, Anti-Russian, Puppets, Euromaidan, Destabilising Russia, Crimea"
1653636596-1292,https://euvsdisinfo.eu/disinformation-cases/?text=&date=&disinfo_countries%5B0%5D=77547&per_page=100&offset=1000,Ukraine's future will be dictated by the US,https://euvsdisinfo.eu/report/ukraines-future-will-be-dictated-by-the-us,Disinfo: Ukraine's future will be dictated by the US,DATE OF PUBLICATION: 10/04/2021,"Keywords: Ukrainian statehood, Sovereignty"
1653636697-1326,https://euvsdisinfo.eu/disinformation-cases/?text=&date=&disinfo_countries%5B0%5D=77547&per_page=100&offset=1000,The US is pushing Ukraine to regain control of Crimea by force,https://euvsdisinfo.eu/report/the-us-is-pushing-ukraine-to-regain-control-of-crimea-by-force,Disinfo: The US is pushing Ukraine to regain control of Crimea by force,DATE OF PUBLICATION: 15/04/2021,"Keywords: Crimea, illegal annexation, Manipulated elections/referendum, Euromaidan, Ukrainian statehood"
1653636711-1331,https://euvsdisinfo.eu/disinformation-cases/?text=&date=&disinfo_countries%5B0%5D=77547&per_page=100&offset=1000,Kyiv’s non-adherence to Minsk deals worsens situation in Donbas,https://euvsdisinfo.eu/report/kyiv-s-non-adherence-to-minsk-deals-worsens-situation-in-donbas,Disinfo: Kyiv’s non-adherence to Minsk deals worsens situation in Donbas,DATE OF PUBLICATION: 15/04/2021,"Keywords: Donbas, War in Ukraine, Military"
1653636469-1247,https://euvsdisinfo.eu/disinformation-cases/?text=&date=&disinfo_countries%5B0%5D=77547&per_page=100&offset=1000,Russia does not threaten Ukraine or any other country,https://euvsdisinfo.eu/report/russia-does-not-threaten-ukraine-or-any-other-country,Disinfo: Russia does not threaten Ukraine or any other country,DATE OF PUBLICATION: 05/04/2021,"Keywords: War in Ukraine, Russian expansionism, Crimea, Russo-Georgian War"
1653636503-1259,https://euvsdisinfo.eu/disinformation-cases/?text=&date=&disinfo_countries%5B0%5D=77547&per_page=100&offset=1000,Ukrainian Armed Forces seek to provoke a full-scale armed conflict in Donbas,https://euvsdisinfo.eu/report/ukrainian-armed-forces-seek-to-provoke-a-full-scale-armed-conflict-in-donbas,Disinfo: Ukrainian Armed Forces seek to provoke a full-scale armed conflict in Donbas,DATE OF PUBLICATION: 07/04/2021,"Keywords: War in Ukraine, Eastern Ukraine, Donbas, Minsk agreements"
1653636486-1253,https://euvsdisinfo.eu/disinformation-cases/?text=&date=&disinfo_countries%5B0%5D=77547&per_page=100&offset=1000,"Kyiv, after the coup, became hostile and keeps on evading talks and agreements",https://euvsdisinfo.eu/report/kyiv-after-the-coup-became-hostile-and-keeps-on-evading-talks-and-agreements,"Disinfo: Kyiv, after the coup, became hostile and keeps on evading talks and agreements",DATE OF PUBLICATION: 06/04/2021,"Keywords: Anti-Russian, DNR, Eastern Ukraine, Euromaidan, Coup, Donbas, West, Sovereignty, War in Ukraine, War crimes, Minsk agreements, Russian language, Russophobia, Ukrainian statehood"
1653636700-1327,https://euvsdisinfo.eu/disinformation-cases/?text=&date=&disinfo_countries%5B0%5D=77547&per_page=100&offset=1000,West pushes Ukraine to the mass destruction of Russians and Ukrainians,https://euvsdisinfo.eu/report/west-pushes-ukraine-to-the-mass-destruction-of-russians-and-ukrainians,Disinfo: West pushes Ukraine to the mass destruction of Russians and Ukrainians,DATE OF PUBLICATION: 15/04/2021,"Keywords: West, War preparation, Anglo-Saxon, Sanctions, Donbas, Warmongering"
1653636648-1310,https://euvsdisinfo.eu/disinformation-cases/?text=&date=&disinfo_countries%5B0%5D=77547&per_page=100&offset=1000,Biden's America is indecently pushing Ukraine into the war,https://euvsdisinfo.eu/report/bidens-america-is-indecently-pushing-ukraine-into-the-war,Disinfo: Biden's America is indecently pushing Ukraine into the war,DATE OF PUBLICATION: 13/04/2021,Keywords: War in Ukraine
1653636725-1336,https://euvsdisinfo.eu/disinformation-cases/?text=&date=&disinfo_countries%5B0%5D=77547&per_page=100&offset=1000,Donbas war is an internal Ukrainian conflict,https://euvsdisinfo.eu/report/donbas-war-is-an-internal-ukrainian-conflict,Disinfo: Donbas war is an internal Ukrainian conflict,DATE OF PUBLICATION: 16/04/2021,"Keywords: Donbas, Eastern Ukraine, War in Ukraine, Civil war"
1653636559-1279,https://euvsdisinfo.eu/disinformation-cases/?text=&date=&disinfo_countries%5B0%5D=77547&per_page=100&offset=1000,Ukrainian media is getting hysterical at the suggestion of its Western guardians,https://euvsdisinfo.eu/report/ukrainian-media-is-getting-hysterical-at-the-suggestion-of-its-western-guardians,Disinfo: Ukrainian media is getting hysterical at the suggestion of its Western guardians,DATE OF PUBLICATION: 09/04/2021,"Keywords: West, Donbas, War in Ukraine, Media, Ukrainian statehood"
1653636674-1318,https://euvsdisinfo.eu/disinformation-cases/?text=&date=&disinfo_countries%5B0%5D=77547&per_page=100&offset=1000,In 2014 coup Kyiv government carried out a war against its own people,https://euvsdisinfo.eu/report/in-2014-coup-kyiv-government-carried-out-a-war-against-its-own-people,Disinfo: In 2014 coup Kyiv government carried out a war against its own people,DATE OF PUBLICATION: 14/04/2021,"Keywords: War in Ukraine, Euromaidan, Coup"
1653636565-1281,https://euvsdisinfo.eu/disinformation-cases/?text=&date=&disinfo_countries%5B0%5D=77547&per_page=100&offset=1000,Ecumenical Patriarch recognised the autocephaly of Ukrainian Orthodox Church with US blessing,https://euvsdisinfo.eu/report/ecumenical-patriarch-recognised-the-autocephaly-of-ukrainian-orthodox-church-with-us-blessing,Disinfo: Ecumenical Patriarch recognised the autocephaly of Ukrainian Orthodox Church with US blessing,DATE OF PUBLICATION: 09/04/2021,Keywords: Orthodox Church
1653636509-1261,https://euvsdisinfo.eu/disinformation-cases/?text=&date=&disinfo_countries%5B0%5D=77547&per_page=100&offset=1000,"Nobody wanted a war in Ukraine, but it was inevitable",https://euvsdisinfo.eu/report/nobody-wanted-a-war-in-ukraine-but-it-was-inevitable,"Disinfo: Nobody wanted a war in Ukraine, but it was inevitable",DATE OF PUBLICATION: 07/04/2021,"Keywords: War in Ukraine, Eastern Ukraine, Warmongering, Abandoned Ukraine, Ukrainian statehood"
